[
    {
        "id": "A01_CREATOR",
        "label": "Criador",
        "essence": "Inovação, imaginação, construção do novo",
        "light": "Cria novas possibilidades, abre caminhos inéditos",
        "shadow": "Perfeccionismo, fuga para a fantasia, caos não estruturado",
        "drives": [
            "Vontade de criação",
            "Afirmação do novo"
        ],
        "journey_role": "Arquétipo que inicia mundos narrativos",
        "stoic_axis": "Propósito ativo",
        "description": "O Criador manifesta novos mundos, ideias e estruturas. Age movido pela necessidade interna de expressar o novo e transformar o abstrato em forma."
    },
    {
        "id": "A02_SAGE",
        "label": "Sábio",
        "essence": "Compreensão, clareza, discernimento",
        "light": "Busca a verdade, ilumina complexidade",
        "shadow": "Intelectualização excessiva, paralisia por análise",
        "drives": [
            "Busca da verdade",
            "Observação"
        ],
        "journey_role": "Guia e conselheiro",
        "stoic_axis": "Racionalidade",
        "description": "O Sábio representa o entendimento profundo, a análise serena e a busca constante por clareza e precisão."
    },
    {
        "id": "A03_MAGICIAN",
        "label": "Mago",
        "essence": "Transformação, insight, transmutação",
        "light": "Vê padrões ocultos, integra opostos, realiza metamorfoses",
        "shadow": "Manipulação, ilusão, controle simbólico",
        "drives": [
            "Integração",
            "Transmutação"
        ],
        "journey_role": "Alquimista e portador do segredo",
        "stoic_axis": "Interioridade",
        "description": "O Mago revela padrões invisíveis e transforma realidades usando conhecimento profundo e precisão simbólica."
    },
    {
        "id": "A04_HERO",
        "label": "Herói",
        "essence": "Coragem, ação, superação",
        "light": "Enfrenta desafios, protege, luta pelo coletivo",
        "shadow": "Ego inflado, excesso de força, busca de aprovação",
        "drives": [
            "Vontade de poder",
            "Afirmação"
        ],
        "journey_role": "Protagonista da Travessia",
        "stoic_axis": "Disciplina",
        "description": "O Herói enfrenta o impossível, rompe barreiras e conduz movimentos através da força, resiliência e ação determinada."
    },
    {
        "id": "A05_EXPLORER",
        "label": "Explorador",
        "essence": "Descoberta, autonomia, expansão de fronteiras",
        "light": "Busca o desconhecido, renova territórios",
        "shadow": "Fuga, inquietação eterna, incapacidade de permanecer",
        "drives": [
            "Liberdade",
            "Expansão"
        ],
        "journey_role": "Rompedor de fronteiras",
        "stoic_axis": "Autonomia",
        "description": "O Explorador rompe limites e reconstrói a realidade movido pela necessidade de expansão, autenticidade e descoberta."
    },
    {
        "id": "A06_CAREGIVER",
        "label": "Cuidador",
        "essence": "Proteção, amparo, estabilidade",
        "light": "Suporta, acolhe, previne danos",
        "shadow": "Sacrifício excessivo, controle emocional, codependência",
        "drives": [
            "Preservação",
            "Bondade"
        ],
        "journey_role": "Guardião",
        "stoic_axis": "Dever",
        "description": "O Cuidador preserva a vida, sustenta o campo emocional e garante que o grupo permaneça seguro, nutrido e estável."
    },
    {
        "id": "A07_RULER",
        "label": "Governante",
        "essence": "Ordem, autoridade, estrutura",
        "light": "Organiza, estabiliza sistemas, cria instituições",
        "shadow": "Tirania, controle excessivo, rigidez",
        "drives": [
            "Ordem",
            "Poder estrutural"
        ],
        "journey_role": "Construtor de civilização",
        "stoic_axis": "Lei e ordem interna",
        "description": "O Governante cria e mantém sistemas que permitem prosperidade, estabilidade e continuidade coletiva."
    },
    {
        "id": "A08_REBEL",
        "label": "Rebelde",
        "essence": "Ruptura, contestação, destruição criativa",
        "light": "Desafia estruturas injustas e cria novos paradigmas",
        "shadow": "Caos, destruição sem propósito, sabotagem",
        "drives": [
            "Libertação",
            "Desobediência"
        ],
        "journey_role": "Disruptor",
        "stoic_axis": "Rejeição do supérfluo",
        "description": "O Rebelde rompe padrões e desafia sistemas que perderam vitalidade. Age como gatilho de destruição criativa."
    },
    {
        "id": "A09_LOVER",
        "label": "Amante",
        "essence": "Conexão, desejo, entrega",
        "light": "Cria vínculos profundos e dá sentido emocional ao mundo",
        "shadow": "Dependência, paixão caótica, possessividade",
        "drives": [
            "União",
            "Afeto"
        ],
        "journey_role": "Força motivadora emocional",
        "stoic_axis": "Sensibilidade disciplinada",
        "description": "O Amante busca união, sentido, intensidade e beleza. Ajuda a criar ligações que movem sistemas humanos."
    },
    {
        "id": "A10_INNOCENT",
        "label": "Inocente",
        "essence": "Esperança, pureza, idealismo",
        "light": "Inspira confiança, simplifica o complexo",
        "shadow": "Ingenuidade, negação, fragilidade",
        "drives": [
            "Esperança",
            "Fé"
        ],
        "journey_role": "Guardião da pureza",
        "stoic_axis": "Humildade",
        "description": "O Inocente representa clareza, otimismo e pureza de propósito. Inspira movimentos baseados em fé e simplicidade."
    },
    {
        "id": "A11_TRICKSTER",
        "label": "Bobo / Trickster",
        "essence": "Humor, ruptura de lógica, imprevisibilidade",
        "light": "Revela paradoxos, quebra ilusões, solta tensões",
        "shadow": "Cinismo, sabotagem, desordem inútil",
        "drives": [
            "Liberdade lúdica",
            "Subversão"
        ],
        "journey_role": "Quebrador de padrões",
        "stoic_axis": "Desapego ao controle",
        "description": "O Trickster inverte regras, revela falhas ocultas e obriga o sistema a se adaptar pela surpresa e pelo absurdo."
    },
    {
        "id": "A12_ORACLE",
        "label": "Oráculo / Profeta",
        "essence": "Visão futura, intuição profunda, verdade velada",
        "light": "Aponta futuros possíveis e revela padrões invisíveis",
        "shadow": "Misticismo vazio, fatalismo, manipulação espiritual",
        "drives": [
            "Visão",
            "Significado"
        ],
        "journey_role": "Portador da revelação",
        "stoic_axis": "Sabedoria contemplativa",
        "description": "O Oráculo capta movimentos profundos do tempo, lê sinais invisíveis e anuncia rupturas e emergências."
    }
]